{
  "schema_version": "0.1",
  "project": {"name": "样例风电项目 EPC", "no": "SAMPLE-2026-001", "purchaser": "样例采购人"},
  "stage": "writing",
  "bid_mode": "normal",
  "deadline": "2026-11-20T09:30+08:00",
  "style_source": "baseline",
  "skill_versions": {
    "tender-document-review": "1.4.0",
    "bid-response-plan": "0.2.0",
    "bid-compliance-check": "0.2.0",
    "bid-technical-proposal": "0.1.1",
    "bid-docx-export": "0.1.1"
  },
  "failed_nodes": [],
  "retry_count": 0,
  "exhausted": false,
  "install_mode": "kit",
  "warnings": [
    {"code": "expiring_soon", "message": "安全生产许可证 2026-12-01 到期，落入换证窗口", "at": "2026-10-17T21:40:00+08:00"}
  ],
  "updated_at": "2026-10-17T21:40:00+08:00"
}
